{
  "schemaVersion": "2026-06-04.agent.skill.search-teaching-material.input.v1",
  "invocationId": "skill_call_search_teaching_material_001",
  "taskId": "agent_task_lesson_quiz_001",
  "contextRef": "ctx_lesson_quiz_triage_001",
  "principalContextRef": "principal-context:teacher_001:session_teacher_001",
  "query": "函数单调性随堂测验教学资料",
  "filters": {
    "ownerType": "TEACHING",
    "materialTypes": ["TEACHING_MATERIAL", "HANDOUT"],
    "tags": ["函数单调性", "随堂测验"],
    "includeStudentArchive": false
  },
  "limits": {
    "maxResults": 5,
    "maxSnippetChars": 240
  },
  "evidenceRefs": [
    "evidence:permission:teaching-read",
    "evidence:lesson-material:index-hash-001"
  ],
  "latencyBudgetMs": 50,
  "writeIntent": false,
  "studentDataAccess": "NONE",
  "externalModelAllowed": false
}
